[{"id":"1017","name":"Northfield State University","domain":"canvas.northfield.example","distance":null,"authentication_provider":"saml"},{"id":"2231","name":"Northfield Community College","domain":"northfieldcc.instructure.example","distance":null,"authentication_provider":"canvas"},{"id":"3302","name":"North Ridge Technical Institute","domain":"nrti.instructure.example","distance":null,"authentication_provider":"openid_connect"},{"id":"4410","name":"Northgate Online Academy","domain":"northgate.instructure.example","distance":null,"authentication_provider":"canvas"}]